{
  "schemaVersion": 1,
  "changeId": "v1.4-stable-promotion",
  "checkpoint": "merge",
  "generatedAt": "2026-10-03T17:16:39.771Z",
  "decision": "ready",
  "reports": {
    "documentation-impact.json": {
      "sha256": "7a2bb1179984f2e79f29b019ba3ca14e8a960962f4f34cac2c38d68fd6466645",
      "bytes": 12966
    },
    "documentation-impact.md": {
      "sha256": "bd5697433539f625319e3fc0c205bc6127d33dff1e450f3fd93fa3007c0a3ade",
      "bytes": 5710
    },
    "updated-documents.md": {
      "sha256": "b29318eb860bae05b78d77e6bd51af07e5a927939dc14a2feefb4c8f0bef212b",
      "bytes": 1800
    },
    "missing-documentation.md": {
      "sha256": "7424b9bb1c66e1fd5c29a0e4e45db7f91a42350f86c1ca91ebd9554f33d0bbe2",
      "bytes": 79
    },
    "documentation-coverage.md": {
      "sha256": "d53a5772d6923008ef93fd7e9549c1210a014c3510b78492aa7642a168663bd0",
      "bytes": 727
    },
    "documentation-quality.json": {
      "sha256": "e9c82a7f7119b0852231b4a56a74ba94c3d2b5eaf50d01ed2dd00244d317a79e",
      "bytes": 1435
    },
    "documentation-synchronization.md": {
      "sha256": "9b4e282c92196577e9cfab687f6a05126ffd9e0a9dffe96312048cfa3e412726",
      "bytes": 117
    },
    "release-documentation-summary.md": {
      "sha256": "7c6ccbdcc606cb0d34eb4eb14b1223c59f31e2d89d36c0cceea76356834c6336",
      "bytes": 130
    },
    "version-history-impact.md": {
      "sha256": "add3ab3c2cec4a039acee104f1d7b77fdd8f1f9b5c7f3ee46b88964e736809fb",
      "bytes": 88
    },
    "migration-impact.md": {
      "sha256": "9d683b7610315a30875c3216773a0dcc43941c59ba77a46848db54fe9b4e709b",
      "bytes": 62
    },
    "repository-health.md": {
      "sha256": "dbc025c76b657bf6e5f16c78d547fb08ca415e70078f00cbf7f39ad2a7c20cc2",
      "bytes": 131
    }
  }
}
