{
  "schemaVersion": 1,
  "changeId": "pr-42",
  "checkpoint": "merge",
  "generatedAt": "2026-08-01T21:29:43.993Z",
  "decision": "ready",
  "reports": {
    "documentation-impact.json": {
      "sha256": "ebf1a86ce27406ccc366a2c130d4826c1943c30a1f9f535685765b3eee2cc790",
      "bytes": 30503
    },
    "documentation-impact.md": {
      "sha256": "a6179a6c0f2ca01a516a9b27bb72328c8d21edd3c546a8ddc3c5ca4b341be234",
      "bytes": 13915
    },
    "updated-documents.md": {
      "sha256": "07bf44cd91f047e9786ed3e1c40d9292e7a5013f4e51fb7190212a1e7f7383e3",
      "bytes": 5181
    },
    "missing-documentation.md": {
      "sha256": "7424b9bb1c66e1fd5c29a0e4e45db7f91a42350f86c1ca91ebd9554f33d0bbe2",
      "bytes": 79
    },
    "documentation-coverage.md": {
      "sha256": "058e0a7bc5b9d403945f569f372ed6902ab2a725a6a3380bb952cb3fdef2b07a",
      "bytes": 727
    },
    "documentation-quality.json": {
      "sha256": "8c8c428b5cc24816ba5d815db53166eac9a0bc2ddfb296f5e1a7996ab4928951",
      "bytes": 1435
    },
    "documentation-synchronization.md": {
      "sha256": "b300c23f14448eed2d0b0540d70834839119d06be5127fdd15ae4774d9f8a945",
      "bytes": 117
    },
    "release-documentation-summary.md": {
      "sha256": "7c6ccbdcc606cb0d34eb4eb14b1223c59f31e2d89d36c0cceea76356834c6336",
      "bytes": 130
    },
    "version-history-impact.md": {
      "sha256": "add3ab3c2cec4a039acee104f1d7b77fdd8f1f9b5c7f3ee46b88964e736809fb",
      "bytes": 88
    },
    "migration-impact.md": {
      "sha256": "9e9de55be656ce219b098dccdfb144cb59da37a659415b4545b3bd2b9faa0971",
      "bytes": 105
    },
    "repository-health.md": {
      "sha256": "7c99b535665f4a772a556e658c6ef46fefa4e7b384a9ac1c906adba69d9e0683",
      "bytes": 131
    }
  }
}
