{
  "schemaVersion": 1,
  "changeId": "v1.4-rc3-release-gate",
  "checkpoint": "merge",
  "generatedAt": "2026-10-02T21:59:23.449Z",
  "decision": "ready",
  "reports": {
    "documentation-impact.json": {
      "sha256": "8f626d0f78e11e86117625f4ea8d7581f155d4d494d077a16000529a0d6742d7",
      "bytes": 12080
    },
    "documentation-impact.md": {
      "sha256": "cdad0f34b61514bfbeda7b000927049f1c72b095a852e5067855926e4bd3e347",
      "bytes": 5212
    },
    "updated-documents.md": {
      "sha256": "2bac48afb6211a4d29b97ec6bbbea5909e149d0f403cc3d64bbcce0df9a6540f",
      "bytes": 1675
    },
    "missing-documentation.md": {
      "sha256": "7424b9bb1c66e1fd5c29a0e4e45db7f91a42350f86c1ca91ebd9554f33d0bbe2",
      "bytes": 79
    },
    "documentation-coverage.md": {
      "sha256": "20b01af793fcf25a8f9d4177c6cb6a6823359fd49e640bdc02245ff7e3036cc6",
      "bytes": 727
    },
    "documentation-quality.json": {
      "sha256": "2ac2ce652c239b523f01ae993f228ca59755da2f971dbf1398fa7c86fac49a91",
      "bytes": 1435
    },
    "documentation-synchronization.md": {
      "sha256": "7d9e478871525b8196c5aa2a29c26982bb812d3a72fdcd5bf1f7b40d21414dfe",
      "bytes": 117
    },
    "release-documentation-summary.md": {
      "sha256": "7c6ccbdcc606cb0d34eb4eb14b1223c59f31e2d89d36c0cceea76356834c6336",
      "bytes": 130
    },
    "version-history-impact.md": {
      "sha256": "add3ab3c2cec4a039acee104f1d7b77fdd8f1f9b5c7f3ee46b88964e736809fb",
      "bytes": 88
    },
    "migration-impact.md": {
      "sha256": "9e9de55be656ce219b098dccdfb144cb59da37a659415b4545b3bd2b9faa0971",
      "bytes": 105
    },
    "repository-health.md": {
      "sha256": "c13791ac4a6b07405b0bda609c7ab5a79a6e85af79d893f2a72241ab5a2c031a",
      "bytes": 131
    }
  }
}
