{
  "schemaVersion": 1,
  "changeId": "v1.4-rc2-preparation",
  "checkpoint": "push",
  "generatedAt": "2026-10-02T19:53:49.356Z",
  "decision": "ready",
  "reports": {
    "documentation-impact.json": {
      "sha256": "8212aaac70e8967a893560f98ba039a88e7111d26df75f933120bf3278e2b3e5",
      "bytes": 9827
    },
    "documentation-impact.md": {
      "sha256": "df63fc4c83dc7b2c203369aa0394dde644e01c611bc166fbd074a4f44f38838a",
      "bytes": 4465
    },
    "updated-documents.md": {
      "sha256": "f8271249968a30094028bb533e37a96c37ef59a427397568914cf4648c77f7b8",
      "bytes": 1457
    },
    "missing-documentation.md": {
      "sha256": "7424b9bb1c66e1fd5c29a0e4e45db7f91a42350f86c1ca91ebd9554f33d0bbe2",
      "bytes": 79
    },
    "documentation-coverage.md": {
      "sha256": "1a8bb0080c30f212b51c883ff19966749a1747ca17973feff93aa371fd7488e0",
      "bytes": 727
    },
    "documentation-quality.json": {
      "sha256": "7d2ed5b47436ef8a7bc40288cc525b2acb18dee51550993283f842831471e0dc",
      "bytes": 1435
    },
    "documentation-synchronization.md": {
      "sha256": "de72995847d824c3f477b7904c350c8fd9c6e894292887b7bd9201e13a0f9f6a",
      "bytes": 115
    },
    "release-documentation-summary.md": {
      "sha256": "7c6ccbdcc606cb0d34eb4eb14b1223c59f31e2d89d36c0cceea76356834c6336",
      "bytes": 130
    },
    "version-history-impact.md": {
      "sha256": "add3ab3c2cec4a039acee104f1d7b77fdd8f1f9b5c7f3ee46b88964e736809fb",
      "bytes": 88
    },
    "migration-impact.md": {
      "sha256": "9e9de55be656ce219b098dccdfb144cb59da37a659415b4545b3bd2b9faa0971",
      "bytes": 105
    },
    "repository-health.md": {
      "sha256": "526f751996c403f7a341def0e5bb3efd2c7bebde8a55d85e6612be6661933180",
      "bytes": 131
    }
  }
}
