{
  "schemaVersion": 1,
  "changeId": "documentation-governance-docker-repair",
  "checkpoint": "merge",
  "generatedAt": "2026-07-28T18:29:07.411Z",
  "decision": "ready",
  "reports": {
    "documentation-impact.json": {
      "sha256": "c3c56e1e7df6ea5ea2f268bd92d78d46e24b012b5dc868d657da982c4f507707",
      "bytes": 29274
    },
    "documentation-impact.md": {
      "sha256": "8ba067ffa22136d2da2785a1ded456ec0a755ff02eaad888850dd8201132d925",
      "bytes": 14064
    },
    "updated-documents.md": {
      "sha256": "4d8cd23fec080b298979f8873d69541a406e051763335e69905d95f20f02263d",
      "bytes": 4970
    },
    "missing-documentation.md": {
      "sha256": "7424b9bb1c66e1fd5c29a0e4e45db7f91a42350f86c1ca91ebd9554f33d0bbe2",
      "bytes": 79
    },
    "documentation-coverage.md": {
      "sha256": "1a29673142261f662f3b7c904062880f23757e0df5e117cba2d3136b93039d7b",
      "bytes": 723
    },
    "documentation-quality.json": {
      "sha256": "9ab3be96ce0881a94b76a78e8d25df4e176bdf5e763c5f62ddff3211ec732bac",
      "bytes": 1435
    },
    "documentation-synchronization.md": {
      "sha256": "35c36e99cca35537a42d912a37c066e98f996d66392f168307e9905b4b940013",
      "bytes": 117
    },
    "release-documentation-summary.md": {
      "sha256": "7c6ccbdcc606cb0d34eb4eb14b1223c59f31e2d89d36c0cceea76356834c6336",
      "bytes": 130
    },
    "version-history-impact.md": {
      "sha256": "add3ab3c2cec4a039acee104f1d7b77fdd8f1f9b5c7f3ee46b88964e736809fb",
      "bytes": 88
    },
    "migration-impact.md": {
      "sha256": "9d683b7610315a30875c3216773a0dcc43941c59ba77a46848db54fe9b4e709b",
      "bytes": 62
    },
    "repository-health.md": {
      "sha256": "675be53057b8352e08e0a6a4eafd3e0568e3d577db300d99c39d052ad9a1eb63",
      "bytes": 131
    }
  }
}
