{
  "schemaVersion": 1,
  "changeId": "version-readiness-remediation-planning",
  "checkpoint": "merge",
  "generatedAt": "2026-07-29T19:46:22.463Z",
  "decision": "ready",
  "reports": {
    "documentation-impact.json": {
      "sha256": "b778918b2f22b2a3c7a6e34c3ca922c4bd86f1f766e58495d91e564fb352638c",
      "bytes": 18662
    },
    "documentation-impact.md": {
      "sha256": "25e3a2a24202ea33f85d7794c911656908eca6155db9900882dbf954f875e579",
      "bytes": 10122
    },
    "updated-documents.md": {
      "sha256": "aed70bbe6ade170143630cdbde4e9ede20aabe3ba5ed73784df70061909b50c4",
      "bytes": 3985
    },
    "missing-documentation.md": {
      "sha256": "7424b9bb1c66e1fd5c29a0e4e45db7f91a42350f86c1ca91ebd9554f33d0bbe2",
      "bytes": 79
    },
    "documentation-coverage.md": {
      "sha256": "792f939bfa1894184616d3930b81c61ee545b3c8158f1cec624fb1155135ba8a",
      "bytes": 725
    },
    "documentation-quality.json": {
      "sha256": "f46c811ff7215011a3a1a1f64bb64d0ba4c7e0077df4bcf389913c84c47db32d",
      "bytes": 1435
    },
    "documentation-synchronization.md": {
      "sha256": "ff03a0c4658b8bdf03ba7e39a0935914a46043787b0c3ff33253c83e0d86d0fb",
      "bytes": 116
    },
    "release-documentation-summary.md": {
      "sha256": "7de64fda9805e4103c1c8a2ffcb2a837db3d1dd5b7c19decd6e99518312325d2",
      "bytes": 93
    },
    "version-history-impact.md": {
      "sha256": "bbcc6e2ca9a1829b68ac414bee4ffb72a84aa6c4f9e81e379f4f0f02a4506911",
      "bytes": 82
    },
    "migration-impact.md": {
      "sha256": "9e9de55be656ce219b098dccdfb144cb59da37a659415b4545b3bd2b9faa0971",
      "bytes": 105
    },
    "repository-health.md": {
      "sha256": "6f3ede51301f810494d3891b41af8ac8f79b65f7d03f515048337293495e2d66",
      "bytes": 131
    }
  }
}
