{
  "schemaVersion": 1,
  "changeId": "release-v1.4.0-rc.1",
  "checkpoint": "release",
  "generatedAt": "2026-08-02T04:48:28.578Z",
  "decision": "ready",
  "reports": {
    "documentation-impact.json": {
      "sha256": "42291f9ca2fea05989b904a03bd8a97e04780e4dba0280271081102a1809d89e",
      "bytes": 130947
    },
    "documentation-impact.md": {
      "sha256": "95b2c7c9094f11dc891e5923c8d664996baeba98d7d01624efa48110ec83360f",
      "bytes": 73789
    },
    "updated-documents.md": {
      "sha256": "9fe5b47e27c40e918ff76b84b7406d968f06b07143fb41648e36a40c71c13814",
      "bytes": 33956
    },
    "missing-documentation.md": {
      "sha256": "7424b9bb1c66e1fd5c29a0e4e45db7f91a42350f86c1ca91ebd9554f33d0bbe2",
      "bytes": 79
    },
    "documentation-coverage.md": {
      "sha256": "49e4c01e8bf5ca78c41e9950a6decf8899d40ecd73b4bf1cc3b262e4df361261",
      "bytes": 727
    },
    "documentation-quality.json": {
      "sha256": "094c788927b3f8b97736a3a9d3fc41b6019acc96b6eaa876ee2a36696e03c183",
      "bytes": 1435
    },
    "documentation-synchronization.md": {
      "sha256": "8423689d3370dd20df93ffc4d1a3c0c4a4e3c1ba3356eff507b67855cc029bae",
      "bytes": 119
    },
    "release-documentation-summary.md": {
      "sha256": "7c6ccbdcc606cb0d34eb4eb14b1223c59f31e2d89d36c0cceea76356834c6336",
      "bytes": 130
    },
    "version-history-impact.md": {
      "sha256": "add3ab3c2cec4a039acee104f1d7b77fdd8f1f9b5c7f3ee46b88964e736809fb",
      "bytes": 88
    },
    "migration-impact.md": {
      "sha256": "9d683b7610315a30875c3216773a0dcc43941c59ba77a46848db54fe9b4e709b",
      "bytes": 62
    },
    "repository-health.md": {
      "sha256": "070a7caa82e3f53acb025daf5ca6e16113934c0488fef3bfc3d1c0cea4c35738",
      "bytes": 131
    }
  }
}
