{
  "schemaVersion": 1,
  "changeId": "v1.4-rc-promotion",
  "checkpoint": "release",
  "generatedAt": "2026-10-02T17:57:04.208Z",
  "decision": "ready",
  "reports": {
    "documentation-impact.json": {
      "sha256": "7fa1f76ed3ae94e8b09b4c53ca33a6ceac4a8405e9b8472cd8a83138bb4791c1",
      "bytes": 1686
    },
    "documentation-impact.md": {
      "sha256": "138328efd45d747333003795080ec607b57c4dac5af9f8cbbce3a7856075c9e0",
      "bytes": 1060
    },
    "updated-documents.md": {
      "sha256": "19eb1a409ee254a5e9c940b0980b2a5e8f0d20b32823ffddc08a2930d2d348c4",
      "bytes": 581
    },
    "missing-documentation.md": {
      "sha256": "7424b9bb1c66e1fd5c29a0e4e45db7f91a42350f86c1ca91ebd9554f33d0bbe2",
      "bytes": 79
    },
    "documentation-coverage.md": {
      "sha256": "40448d1140f02ff3302b9e7faa9cb68df6c6d40ad3f59d31408d046d46b8e017",
      "bytes": 727
    },
    "documentation-quality.json": {
      "sha256": "7d4df7489a8630636a0bfe92b52384a6717ea7b05beb82e8061530d35eef0e13",
      "bytes": 1435
    },
    "documentation-synchronization.md": {
      "sha256": "432f12c08b771eaff84a8245a2259a275d9dd94623e534eed13ece3e1c016a46",
      "bytes": 118
    },
    "release-documentation-summary.md": {
      "sha256": "7de64fda9805e4103c1c8a2ffcb2a837db3d1dd5b7c19decd6e99518312325d2",
      "bytes": 93
    },
    "version-history-impact.md": {
      "sha256": "bbcc6e2ca9a1829b68ac414bee4ffb72a84aa6c4f9e81e379f4f0f02a4506911",
      "bytes": 82
    },
    "migration-impact.md": {
      "sha256": "9e9de55be656ce219b098dccdfb144cb59da37a659415b4545b3bd2b9faa0971",
      "bytes": 105
    },
    "repository-health.md": {
      "sha256": "54a4eb45257454cc33c76fabc3cf92f6170a54f63ec09bc0eb84efcf82ba7628",
      "bytes": 131
    }
  }
}
