{
  "schemaVersion": 1,
  "changeId": "version-documentation-system",
  "checkpoint": "merge",
  "generatedAt": "2026-07-29T11:11:21.153Z",
  "decision": "ready",
  "reports": {
    "documentation-impact.json": {
      "sha256": "61eb45e3a4fba84e21fcc2f486d990a0dcfeda5466443f9e53b22f3760bb4b2e",
      "bytes": 57231
    },
    "documentation-impact.md": {
      "sha256": "8f1f60f182b556ae36d0be0371da7b99e8ea321fb49dacae6e76f70e966b5ed8",
      "bytes": 32212
    },
    "updated-documents.md": {
      "sha256": "aac261ed7c84ba6042ed3855e52e9ce0cd41075d3ac60c89d4eb45a9b3bbbbd2",
      "bytes": 14476
    },
    "missing-documentation.md": {
      "sha256": "7424b9bb1c66e1fd5c29a0e4e45db7f91a42350f86c1ca91ebd9554f33d0bbe2",
      "bytes": 79
    },
    "documentation-coverage.md": {
      "sha256": "7436104254d674808cfccfe53aba78dac079b61661b8ebd46193812c0c9057ae",
      "bytes": 725
    },
    "documentation-quality.json": {
      "sha256": "1e1f33250b9456fd6e7cff569a10616427429e4db569807eac97361022661a7f",
      "bytes": 1435
    },
    "documentation-synchronization.md": {
      "sha256": "35c36e99cca35537a42d912a37c066e98f996d66392f168307e9905b4b940013",
      "bytes": 117
    },
    "release-documentation-summary.md": {
      "sha256": "7c6ccbdcc606cb0d34eb4eb14b1223c59f31e2d89d36c0cceea76356834c6336",
      "bytes": 130
    },
    "version-history-impact.md": {
      "sha256": "add3ab3c2cec4a039acee104f1d7b77fdd8f1f9b5c7f3ee46b88964e736809fb",
      "bytes": 88
    },
    "migration-impact.md": {
      "sha256": "eea15379526ce1e56bd540efcc4f0d61cffe914dedd80819f5b6313b9cb16033",
      "bytes": 231
    },
    "repository-health.md": {
      "sha256": "e49fc2145930d3324fd8ef9fc5dd641d29a3840ef4de5f94d9f14c4d5038a4b4",
      "bytes": 131
    }
  }
}
